index,score,text
1951,1.0,bluz omzu açık özel tasarım bluz likralı kumaş yapısıyl yumuşak doku nefes alabilir kumaş günlük kullanım uyg şık tasarım şıklık konfor ara ön çıkan özellik yumuşak doku nefes alabilir kumaş günlük kullanım uyg şık tasarım siyah bluz
2666,1.0,bluz omzu açık gardıropt olması gereken bluz deri görünümlü içeriğiyl günlük kullanım uyg kolay ütülenir düğmeli model şık tasarım sezo trend renkleriyl komb yapabilirsiniz ön çıkan özellik günlük kullanım uyg kolay ütülenir düğmeli model şık tasarım siyah bluz
515,1.0,bluz omzu açık bluz modeli saten kumaştan üretilmiş olup şık tasarım esnek yapı nefes alabilir kumaş düğmeli model şıklık konfor ara ön çıkan özellik şık tasarım esnek yapı nefes alabilir kumaş düğmeli model siyah bluz
3342,1.0,bluz omzu açık gardıropt olması gereken bluz saten içeriğiyl günlük kullanım uyg yumuşak doku çift cepli düğmeli model gardırobunuz vazgeçilmezi olma aday ön çıkan özellik günlük kullanım uyg yumuşak doku çift cepli düğmeli model siyah bluz
410,1.0,bluz omzu açık gardıropt olması gereken bluz 100 pamuk içeriğiyl nefes alabilir kumaş yumuşak doku ofisten sokağ ortam uyum sağ ön çıkan özellik nefes alabilir kumaş yumuşak doku siyah bluz
